{
  "schema_version": 1,
  "report": {
    "id": "glm53-coldgrid-capacity-20260924",
    "title": "GLM-5.3 - Prefill and Decode Capacity",
    "output_filename": "comino-8x--glm5.3--cold-capacity-report.html",
    "comparable": true,
    "campaign_date": "2026-09-24",
    "subtitle": "RadixArk GLM-5.3 on one eight-GPU TP8 vLLM replica, global concurrency 1 to 64, cold-uncached prefill"
  },
  "source": {
    "campaign_id": "glm53-coldgrid-20260924",
    "campaign_path": "results/comino-8x-rtx6000/glm5.3/5-campaign/glm53-coldgrid-20260924",
    "normalized_data": "normalized-report-data.json"
  },
  "model": {
    "display_name": "GLM-5.3",
    "repository": "RadixArk/GLM-5.3-NVFP4",
    "revision": "363e8f086905afd83db356a620f9aa401c23800a",
    "served_name": "glm-5.3-nvfp4-radixark",
    "quantization": "ModelOpt NVFP4 (modelopt_fp4), KV cache FP8"
  },
  "hardware": {
    "host": "comino-8x",
    "gpu_count": 8,
    "gpu_model": "NVIDIA RTX PRO 6000 Blackwell Server Edition 96 GB",
    "logical_cpu_count": 128
  },
  "deployment": {
    "topology_display": "one TP8 vLLM replica across eight GPUs behind haproxy (single backend); decode profile spliced at C24",
    "replicas": 1,
    "tensor_parallel_per_replica": 8,
    "max_model_len": 262144,
    "max_num_seqs_per_replica": 64,
    "active_sequence_ceiling": 64,
    "cudagraph_capture_size": 256,
    "max_num_batched_tokens_per_replica": 8192,
    "kv_cache_dtype": "fp8",
    "speculative_decoding": "MTP-3",
    "cpu_numa_affinity": "single NUMA node (EPYC 9575F); not pinned",
    "host_ram_limit_gib": null
  },
  "axis": {
    "measured_concurrency": [1, 8, 16, 24, 32, 48, 64],
    "maximum": 64,
    "major_ticks": [1, 8, 16, 24, 32, 48, 64]
  },
  "metrics": {
    "energy_method": "integrated_gpu_board_power",
    "loaded_idle_baseline": true,
    "temperature": true,
    "load_balancer": true,
    "pcie": false
  },
  "fabric_qualification_path": null,
  "provenance_notes": [
    "Frozen before measurement: Dell xe7740 deployment parameters verbatim by user decision (param raster skipped); corrected-cold aiperf invocation (num-dataset-entries 4000, sequential, per-(C,rep) seeds 600000+C*1000+rep); published 7-point axis [1,8,16,24,32,48,64].",
    "Decode profile spliced like the published xe7740 series: C1-C24 on max_num_seqs 32 / cudagraph 128, C32-C64 on max_num_seqs 64 / cudagraph 256 (two container launches).",
    "Engine: vLLM 0.26.1rc0 (voipmonitor/vllm base), InstantTensor load, modelopt_fp4, KV fp8, MTP-3, B12X MLA sparse, async scheduling; realized args verified from startup logs (segments/*/params.txt).",
    "Prefill verified uncached on every rep: engine /metrics prefix_cache_hits/queries deltas, fail-closed gate <=1%, all reps 0.0%; client-side usage_prompt_cache_read_tokens 0.",
    "Correctness gate 7/7 through the measured path after each fleet boot; B0 unloaded idle and B1-pre/post loaded-idle baselines captured (preflight/ + baselines/).",
    "42 measured runs, 0 aiperf errors, 0 gate violations, 0 excluded runs."
  ]
}
